{
  "id": "RULE-NET-001",
  "name": "Sin Internet únicamente en este equipo",
  "priority": 100,
  "conditions": [
    {
      "field": "evidence",
      "operator": "contains",
      "value": "localNetworkNoAccess"
    }
  ],
  "actions": [
    {
      "type": "recommend",
      "target": "WHPRS-NET-001",
      "weight": 1
    },
    {
      "type": "recommend",
      "target": "WHPRS-NET-002",
      "weight": 0.9
    },
    {
      "type": "recommend",
      "target": "WHPRS-NET-005",
      "weight": 0.8
    },
    {
      "type": "validate",
      "target": "VAL-NET-001",
      "weight": 1
    }
  ],
  "status": "active",
  "version": "1.0.0"
}