{
  "id": "RULE-SEC-003",
  "name": "Síntomas de malware sin detección inicial",
  "priority": 120,
  "conditions": [
    {
      "field": "evidence",
      "operator": "contains",
      "value": "malwareSymptomsNoDetection"
    }
  ],
  "actions": [
    {
      "type": "recommend",
      "target": "WHPRS-SEC-003",
      "weight": 1
    },
    {
      "type": "recommend",
      "target": "WHPRS-SEC-005",
      "weight": 0.8
    },
    {
      "type": "validate",
      "target": "VAL-SEC-003",
      "weight": 1
    }
  ],
  "status": "active",
  "version": "1.0.0"
}