{
  "id": "RULE-PERF-003",
  "name": "PC lenta con uso elevado de CPU",
  "priority": 95,
  "conditions": [
    {
      "field": "evidence",
      "operator": "contains",
      "value": "cpuUsageHigh"
    }
  ],
  "actions": [
    {
      "type": "recommend",
      "target": "WHPRS-DIA-001",
      "weight": 0.7
    },
    {
      "type": "recommend",
      "target": "WHPRS-DIA-003",
      "weight": 0.95
    },
    {
      "type": "validate",
      "target": "VAL-PERF-003",
      "weight": 1
    }
  ],
  "status": "active",
  "version": "1.0.0"
}