{
  "id": "RULE-BOOT-004",
  "name": "Unidad de arranque no detectada",
  "priority": 150,
  "conditions": [
    {
      "field": "evidence",
      "operator": "contains",
      "value": "bootDriveNotDetected"
    }
  ],
  "actions": [
    {
      "type": "recommend",
      "target": "WHPRS-DIA-004",
      "weight": 1
    },
    {
      "type": "validate",
      "target": "VAL-BOOT-004",
      "weight": 1
    }
  ],
  "status": "active",
  "version": "1.0.0"
}