{
  "id": "RULE-SEC-001",
  "name": "Alerta o cuarentena de Microsoft Defender",
  "priority": 110,
  "conditions": [
    {
      "field": "evidence",
      "operator": "contains",
      "value": "defenderAlertDetected"
    }
  ],
  "actions": [
    {
      "type": "recommend",
      "target": "WHPRS-SEC-001",
      "weight": 1
    },
    {
      "type": "recommend",
      "target": "WHPRS-SEC-002",
      "weight": 0.9
    },
    {
      "type": "validate",
      "target": "VAL-SEC-001",
      "weight": 1
    }
  ],
  "status": "active",
  "version": "1.0.0"
}