{
  "id": "RULE-GAM-003",
  "name": "Stutter o tirones durante el juego",
  "priority": 115,
  "conditions": [
    {
      "field": "evidence",
      "operator": "contains",
      "value": "gameStutter"
    }
  ],
  "actions": [
    {
      "type": "recommend",
      "target": "WHPRS-DIA-002",
      "weight": 0.8
    },
    {
      "type": "recommend",
      "target": "WHPRS-GAM-003",
      "weight": 1
    },
    {
      "type": "recommend",
      "target": "WHPRS-OPT-001",
      "weight": 0.75
    },
    {
      "type": "validate",
      "target": "VAL-GAM-003",
      "weight": 1
    }
  ],
  "status": "active",
  "version": "1.0.0"
}