{
  "id": "RULE-NET-004",
  "name": "Conexión lenta o intermitente",
  "priority": 95,
  "conditions": [
    {
      "field": "evidence",
      "operator": "contains",
      "value": "networkIntermittent"
    }
  ],
  "actions": [
    {
      "type": "recommend",
      "target": "WHPRS-NET-002",
      "weight": 1
    },
    {
      "type": "recommend",
      "target": "WHPRS-NET-006",
      "weight": 0.95
    },
    {
      "type": "validate",
      "target": "VAL-NET-004",
      "weight": 1
    }
  ],
  "status": "active",
  "version": "1.0.0"
}