{
  "id": "RULE-SEC-004",
  "name": "Amenaza persistente o recurrente",
  "priority": 130,
  "conditions": [
    {
      "field": "evidence",
      "operator": "contains",
      "value": "persistentThreat"
    }
  ],
  "actions": [
    {
      "type": "recommend",
      "target": "WHPRS-SEC-001",
      "weight": 0.8
    },
    {
      "type": "recommend",
      "target": "WHPRS-SEC-004",
      "weight": 1
    },
    {
      "type": "validate",
      "target": "VAL-SEC-004",
      "weight": 1
    }
  ],
  "status": "active",
  "version": "1.0.0"
}