{
  "id": "RULE-GAM-004",
  "name": "Rendimiento limitado por energía",
  "priority": 120,
  "conditions": [
    {
      "field": "evidence",
      "operator": "contains",
      "value": "gamePowerLimited"
    }
  ],
  "actions": [
    {
      "type": "recommend",
      "target": "WHPRS-GAM-004",
      "weight": 1
    },
    {
      "type": "recommend",
      "target": "WHPRS-GAM-003",
      "weight": 0.8
    },
    {
      "type": "validate",
      "target": "VAL-GAM-004",
      "weight": 1
    }
  ],
  "status": "active",
  "version": "1.0.0"
}