{
  "id": "RULE-BSOD-004",
  "name": "Pantalla azul después de un cambio reciente",
  "priority": 150,
  "conditions": [
    {
      "field": "evidence",
      "operator": "contains",
      "value": "bsodAfterRecentChange"
    }
  ],
  "actions": [
    {
      "type": "recommend",
      "target": "WHPRS-DIA-005",
      "weight": 0.9
    },
    {
      "type": "recommend",
      "target": "WHPRS-REC-002",
      "weight": 0.75
    },
    {
      "type": "recommend",
      "target": "WHPRS-REC-004",
      "weight": 1
    },
    {
      "type": "validate",
      "target": "VAL-BSOD-004",
      "weight": 1
    }
  ],
  "status": "active",
  "version": "1.0.0"
}