{
  "id": "RULE-NET-003",
  "name": "Conectado a la red pero sin acceso a Internet",
  "priority": 100,
  "conditions": [
    {
      "field": "evidence",
      "operator": "contains",
      "value": "connectedWithoutInternet"
    }
  ],
  "actions": [
    {
      "type": "recommend",
      "target": "WHPRS-NET-001",
      "weight": 1
    },
    {
      "type": "recommend",
      "target": "WHPRS-NET-005",
      "weight": 0.95
    },
    {
      "type": "recommend",
      "target": "WHPRS-NET-004",
      "weight": 0.8
    },
    {
      "type": "validate",
      "target": "VAL-NET-003",
      "weight": 1
    }
  ],
  "status": "active",
  "version": "1.0.0"
}