{
  "id": "RULE-PERF-004",
  "name": "PC lenta sin recurso identificado",
  "priority": 90,
  "conditions": [
    {
      "field": "evidence",
      "operator": "contains",
      "value": "resourceUsageUnknown"
    }
  ],
  "actions": [
    {
      "type": "recommend",
      "target": "WHPRS-DIA-002",
      "weight": 1
    },
    {
      "type": "recommend",
      "target": "WHPRS-DIA-003",
      "weight": 0.9
    },
    {
      "type": "validate",
      "target": "VAL-PERF-004",
      "weight": 1
    }
  ],
  "status": "active",
  "version": "1.0.0"
}