{
  "id": "RULE-GAM-001",
  "name": "Juego utilizando la GPU incorrecta",
  "priority": 120,
  "conditions": [
    {
      "field": "evidence",
      "operator": "contains",
      "value": "gameUsesWrongGpu"
    }
  ],
  "actions": [
    {
      "type": "recommend",
      "target": "WHPRS-GAM-001",
      "weight": 0.8
    },
    {
      "type": "recommend",
      "target": "WHPRS-GAM-002",
      "weight": 1
    },
    {
      "type": "validate",
      "target": "VAL-GAM-001",
      "weight": 1
    }
  ],
  "status": "active",
  "version": "1.0.0"
}