{
  "id": "RULE-SEC-002",
  "name": "Archivo sospechoso abierto o descargado",
  "priority": 115,
  "conditions": [
    {
      "field": "evidence",
      "operator": "contains",
      "value": "suspiciousFileExecuted"
    }
  ],
  "actions": [
    {
      "type": "recommend",
      "target": "WHPRS-SEC-001",
      "weight": 0.8
    },
    {
      "type": "recommend",
      "target": "WHPRS-SEC-003",
      "weight": 1
    },
    {
      "type": "recommend",
      "target": "WHPRS-SEC-005",
      "weight": 0.75
    },
    {
      "type": "validate",
      "target": "VAL-SEC-002",
      "weight": 1
    }
  ],
  "status": "active",
  "version": "1.0.0"
}