{
  "id": "RULE-BSOD-002",
  "name": "Pantalla azul aleatoria",
  "priority": 150,
  "conditions": [
    {
      "field": "evidence",
      "operator": "contains",
      "value": "bsodRandom"
    }
  ],
  "actions": [
    {
      "type": "recommend",
      "target": "WHPRS-DIA-005",
      "weight": 0.9
    },
    {
      "type": "recommend",
      "target": "WHPRS-DIA-006",
      "weight": 0.85
    },
    {
      "type": "recommend",
      "target": "WHPRS-DIA-007",
      "weight": 1
    },
    {
      "type": "validate",
      "target": "VAL-BSOD-002",
      "weight": 1
    }
  ],
  "status": "active",
  "version": "1.0.0"
}