{
  "id": "RULE-PERF-002",
  "name": "PC lenta con uso elevado de memoria RAM",
  "priority": 95,
  "conditions": [
    {
      "field": "evidence",
      "operator": "contains",
      "value": "memoryUsageHigh"
    }
  ],
  "actions": [
    {
      "type": "recommend",
      "target": "WHPRS-DIA-001",
      "weight": 0.7
    },
    {
      "type": "recommend",
      "target": "WHPRS-DIA-002",
      "weight": 0.9
    },
    {
      "type": "recommend",
      "target": "WHPRS-OPT-001",
      "weight": 0.8
    },
    {
      "type": "validate",
      "target": "VAL-PERF-002",
      "weight": 1
    }
  ],
  "status": "active",
  "version": "1.0.0"
}